Title,Media URL,Pinterest board,Thumbnail,Description,Link,Publish date,Keywords
"Revamped Caesar Salad: Your New Favorite Recipe!","https://www.pinrecipes.org/posts/quick-15-minute-caesar-salad-with-garlic-croutons/images/quick-15-minute-caesar-salad-with-garlic-croutons_pinrecipes_image_1.webp","caesar-salad-recipes",,"Discover a fresh twist on the classic Caesar salad! Crisp romaine homemade garlic croutons and a rich creamy dressing come together for a delightful meal. Whether for lunch or dinner this quick and easy recipe will satisfy your cravings. Dive into this refreshing dish and elevate your salad game!","https://www.pinrecipes.org/posts/quick-15-minute-caesar-salad-with-garlic-croutons/?src=quick-15-minute-caesar-salad-with-garlic-croutons-image-1","2026-03-18T16:09:00","CaesarSalad, HealthyEating, DinnerIdeas, SaladRecipes"
"Bacon-Wrapped Caesar Salad: A Delicious Upgrade","https://www.pinrecipes.org/posts/ultimate-caesar-salad-with-crispy-bacon-and-parmesan/images/ultimate-caesar-salad-with-crispy-bacon-and-parmesan_pinrecipes_image_1.webp","caesar-salad-recipes",,"Transform your lunch with this Bacon-Wrapped Caesar Salad! Crisp romaine savory bacon and fresh parmesan come together for a flavor explosion. Perfect for impressing guests or a weeknight treat. Dive into this delightful twist on a classic that everyone will love!","https://www.pinrecipes.org/posts/ultimate-caesar-salad-with-crispy-bacon-and-parmesan/?src=ultimate-caesar-salad-with-crispy-bacon-and-parmesan-image-1","2026-03-18T17:07:00","CaesarSalad, BaconLovers, HealthyEats, RecipeTwist, FreshFlavors"
"Elevate Your Salad Game with Classic Caesar","https://www.pinrecipes.org/posts/classic-caesar-salad-recipe-from-scratch-every-time/images/classic-caesar-salad-recipe-from-scratch-every-time_pinrecipes_image_1.webp","caesar-salad-recipes",,"Learn the art of making the perfect Classic Caesar Salad! Featuring crisp romaine homemade croutons and a rich creamy dressing this recipe will become a staple in your home. Impress your family and friends with this timeless favorite that’s both delicious and easy to prepare!","https://www.pinrecipes.org/posts/classic-caesar-salad-recipe-from-scratch-every-time/?src=classic-caesar-salad-recipe-from-scratch-every-time-image-1","2026-03-18T18:17:00","CaesarSalad, HealthyEating, HomemadeDressing, SaladRecipes"
"Deliciously Creamy Maple Bacon Pork Chops!","https://www.pinrecipes.org/posts/irresistible-maple-bacon-pork-chops-with-dijon-mustard-cream-sauce-easy-comfort-food/images/irresistible-maple-bacon-pork-chops-with-dijon-mustard-cream-sauce-easy-comfort-food_pinrecipes_image_1.webp","easy-dinner-ideas",,"Savor the flavors of succulent pork chops drizzled with a creamy Dijon mustard sauce! This irresistible maple bacon recipe is perfect for turning your family dinners into culinary delights. Your loved ones will be asking for seconds! 🍽️✨","https://www.pinrecipes.org/posts/irresistible-maple-bacon-pork-chops-with-dijon-mustard-cream-sauce-easy-comfort-food/?src=irresistible-maple-bacon-pork-chops-with-dijon-mustard-cream-sauce-easy-comfort-food-image-1","2026-03-18T19:23:00","ComfortFood, PorkChops, MapleBacon, DijonMustard, EasyRecipes"
"Elevate Your Salads with Homemade Caesar Dressing!","https://www.pinrecipes.org/posts/homemade-caesar-dressing-that-beats-store-bought-every-time/images/homemade-caesar-dressing-that-beats-store-bought-every-time_pinrecipes_image_1.webp","caesar-dressing-recipes",,"Discover the secret to a delicious salad with this homemade Caesar dressing! Creamy fresh and made from scratch it's ideal for impressing guests or enjoying on a cozy night in. Say goodbye to store-bought and hello to flavor!","https://www.pinrecipes.org/posts/homemade-caesar-dressing-that-beats-store-bought-every-time/?src=homemade-caesar-dressing-that-beats-store-bought-every-time-image-1","2026-03-18T20:12:00","CaesarDressing, Homemade, SaladRecipes, HealthyEating"
"The Ultimate Caesar Dressing Recipe You'll Love","https://www.pinrecipes.org/posts/easy-homemade-caesar-dressing-that-beats-restaurant-style/images/easy-homemade-caesar-dressing-that-beats-restaurant-style_pinrecipes_image_1.webp","caesar-dressing-recipes",,"Try this creamy and tangy homemade Caesar dressing that's better than any restaurant! With fresh garlic Parmesan cheese and a perfect balance of flavors it's ideal for salads or a delicious veggie dip. Elevate your meals with this easy recipe.","https://www.pinrecipes.org/posts/easy-homemade-caesar-dressing-that-beats-restaurant-style/?src=easy-homemade-caesar-dressing-that-beats-restaurant-style-image-1","2026-03-18T21:23:00","CaesarDressing, HomemadeRecipes, HealthyEating, SaladDressing"
"Creamy Caesar Dressing: Elevate Your Salad Game!","https://www.pinrecipes.org/posts/homemade-caesar-salad-dressing-a-classic-twist/images/homemade-caesar-salad-dressing-a-classic-twist_pinrecipes_image_1.webp","caesar-dressing-recipes",,"Discover the secret to a perfect Caesar salad with this homemade dressing! Crafted with fresh ingredients and a delightful hint of anchovy it's sure to impress at your next meal. Say goodbye to store-bought dressings and hello to creamy perfection! 🍴🥗","https://www.pinrecipes.org/posts/homemade-caesar-salad-dressing-a-classic-twist/?src=homemade-caesar-salad-dressing-a-classic-twist-image-1","2026-03-18T22:32:00","CaesarSalad, HomemadeDressing, HealthyEating, Foodie"
"Elevate Your Salads with Homemade Caesar Dressing! 2","https://www.pinrecipes.org/posts/authentic-caesar-dressing-recipe-you-ll-never-buy-again/images/authentic-caesar-dressing-recipe-you-ll-never-buy-again_pinrecipes_image_1.webp","caesar-dressing-recipes",,"Discover the secret to the best Caesar dressing you'll ever taste! Made with fresh ingredients and a hint of anchovy it's perfect for salads and impressing guests at your dinner parties. Say goodbye to store-bought dressings forever!","https://www.pinrecipes.org/posts/authentic-caesar-dressing-recipe-you-ll-never-buy-again/?src=authentic-caesar-dressing-recipe-you-ll-never-buy-again-image-1","2026-03-18T23:36:00","CaesarDressing, Homemade, SaladRecipes, DinnerParty"
"Deliciously Easy Green St. Patrick’s Day Recipes to Try Now","https://www.pinrecipes.org/posts/easy-and-festive-green-st-patrick-s-day-recipes-everyone-will-love/images/easy-and-festive-green-st-patrick-s-day-recipes-everyone-will-love_pinrecipes_image_1.webp","easy-holiday-recipes",,"Celebrate St. Patrick’s Day with these simple and festive green recipes! From creamy spinach dips to shamrock-shaped treats these dishes are perfect for a fun hassle-free holiday.","https://www.pinrecipes.org/posts/easy-and-festive-green-st-patrick-s-day-recipes-everyone-will-love/?src=easy-and-festive-green-st-patrick-s-day-recipes-everyone-will-love-image-1","2026-03-19T00:37:00","StPatricksDay, GreenRecipes, FestiveFood, EasyRecipes, HolidayCooking"
"Irresistible Irish Beef & Guinness Stew for St. Patrick’s Day","https://www.pinrecipes.org/posts/hearty-irish-beef-and-guinness-stew-to-warm-your-st-patrick-s-day/images/hearty-irish-beef-and-guinness-stew-to-warm-your-st-patrick-s-day_pinrecipes_image_1.webp","cozy-irish-dinner-recipes",,"Warm up your St. Paddy’s Day with this rich Irish beef and Guinness stew! Slow-cooked to perfection it's loaded with tender meat and hearty veggies. A cozy meal that’s perfect for family and friends.","https://www.pinrecipes.org/posts/hearty-irish-beef-and-guinness-stew-to-warm-your-st-patrick-s-day/?src=hearty-irish-beef-and-guinness-stew-to-warm-your-st-patrick-s-day-image-1","2026-03-19T01:29:00","IrishRecipes, GuinnessStew, StPatricksDayDinner, ComfortFood, BeefStew"
"Classic Caesar Salad Reimagined: Easy & Delicious","https://www.pinrecipes.org/posts/quick-15-minute-caesar-salad-with-garlic-croutons/images/quick-15-minute-caesar-salad-with-garlic-croutons_pinrecipes_image_2.webp","caesar-salad-recipes",,"Indulge in a modern take on an all-time favorite: the Caesar salad! Featuring fresh romaine crispy garlic croutons and a luscious dressing this recipe is both quick and delicious. Perfect for a light meal or as a side dish it's sure to impress your family and friends. Get ready to enjoy a satisfying and vibrant salad!","https://www.pinrecipes.org/posts/quick-15-minute-caesar-salad-with-garlic-croutons/?src=quick-15-minute-caesar-salad-with-garlic-croutons-image-2","2026-03-23T16:14:00","HealthyRecipes, CaesarSalad, FreshFood, EasyMeals"
"Ultimate Crispy Bacon Caesar Salad Recipe","https://www.pinrecipes.org/posts/ultimate-caesar-salad-with-crispy-bacon-and-parmesan/images/ultimate-caesar-salad-with-crispy-bacon-and-parmesan_pinrecipes_image_2.webp","caesar-salad-recipes",,"Discover the Ultimate Crispy Bacon Caesar Salad! Elevated with crunchy bacon and rich parmesan this recipe is a must-try for salad lovers. Enjoy a light yet satisfying meal perfect for lunch or dinner. Your family and friends will be begging for seconds!","https://www.pinrecipes.org/posts/ultimate-caesar-salad-with-crispy-bacon-and-parmesan/?src=ultimate-caesar-salad-with-crispy-bacon-and-parmesan-image-2","2026-03-23T16:59:00","SaladRecipe, CrispyBacon, HealthyRecipes, Foodie, DeliciousEats"
"The Ultimate Caesar Salad Recipe You Must Try!","https://www.pinrecipes.org/posts/classic-caesar-salad-recipe-from-scratch-every-time/images/classic-caesar-salad-recipe-from-scratch-every-time_pinrecipes_image_2.webp","caesar-salad-recipes",,"Unleash the flavors of a Classic Caesar Salad made from scratch! With fresh romaine lettuce crunchy croutons and a velvety dressing this dish is sure to wow your guests at any gathering. Join us in creating this delectable salad that marries simplicity with taste.","https://www.pinrecipes.org/posts/classic-caesar-salad-recipe-from-scratch-every-time/?src=classic-caesar-salad-recipe-from-scratch-every-time-image-2","2026-03-23T18:06:00","ClassicCaesar, Foodie, SaladLovers, RecipeOfTheDay"
"Maple Bacon Pork Chops: Your New Favorite Dinner!","https://www.pinrecipes.org/posts/irresistible-maple-bacon-pork-chops-with-dijon-mustard-cream-sauce-easy-comfort-food/images/irresistible-maple-bacon-pork-chops-with-dijon-mustard-cream-sauce-easy-comfort-food_pinrecipes_image_2.webp","easy-dinner-ideas",,"Elevate your dinner game with these maple bacon pork chops topped with a luscious Dijon cream sauce. Ideal for weeknight meals or special gatherings this recipe is a must-try! Enjoy a taste of comfort food that’s quick and satisfying. 🥓🥩","https://www.pinrecipes.org/posts/irresistible-maple-bacon-pork-chops-with-dijon-mustard-cream-sauce-easy-comfort-food/?src=irresistible-maple-bacon-pork-chops-with-dijon-mustard-cream-sauce-easy-comfort-food-image-2","2026-03-23T18:58:00","EasyDinner, PorkRecipes, MapleBacon, CreamSauce, DinnerInspiration"
"DIY Caesar Dressing: Fresh Easy and Irresistible!","https://www.pinrecipes.org/posts/homemade-caesar-dressing-that-beats-store-bought-every-time/images/homemade-caesar-dressing-that-beats-store-bought-every-time_pinrecipes_image_2.webp","caesar-dressing-recipes",,"Transform your salads with this easy homemade Caesar dressing! Packed with fresh ingredients it's a game changer for any meal. Perfect for gatherings or a simple weeknight dinner this creamy delight will have everyone asking for more.","https://www.pinrecipes.org/posts/homemade-caesar-dressing-that-beats-store-bought-every-time/?src=homemade-caesar-dressing-that-beats-store-bought-every-time-image-2","2026-03-23T20:03:00","SaladLove, CaesarDressing, HealthyRecipes, Foodie"
"Say Goodbye to Store-Bought Dressing! Try This Caesar Recipe","https://www.pinrecipes.org/posts/easy-homemade-caesar-dressing-that-beats-restaurant-style/images/easy-homemade-caesar-dressing-that-beats-restaurant-style_pinrecipes_image_2.webp","caesar-dressing-recipes",,"Make your salads unforgettable with this easy homemade Caesar dressing! Creamy tangy and loaded with fresh garlic and Parmesan it's the perfect addition to any meal. Whether you’re dipping veggies or drizzling it on salads this recipe beats the store-bought kind every time.","https://www.pinrecipes.org/posts/easy-homemade-caesar-dressing-that-beats-restaurant-style/?src=easy-homemade-caesar-dressing-that-beats-restaurant-style-image-2","2026-03-23T21:05:00","HomemadeDressing, CaesarSalad, YummyRecipes, CookingAtHome"
"Game-Changing Caesar Dressing Recipe","https://www.pinrecipes.org/posts/homemade-caesar-salad-dressing-a-classic-twist/images/homemade-caesar-salad-dressing-a-classic-twist_pinrecipes_image_2.webp","caesar-dressing-recipes",,"Transform your salads with this mouthwatering homemade Caesar dressing! Mixing fresh flavors and an unexpected touch of anchovy this recipe is a must-try for salad lovers. Perfect for any occasion your greens will never taste better! 🌱✨","https://www.pinrecipes.org/posts/homemade-caesar-salad-dressing-a-classic-twist/?src=homemade-caesar-salad-dressing-a-classic-twist-image-2","2026-03-23T22:02:00","CaesarDressing, SaladRecipes, HealthyLiving, Delicious"
"Say Goodbye to Store-Bought: Easy Caesar Dressing Recipe","https://www.pinrecipes.org/posts/authentic-caesar-dressing-recipe-you-ll-never-buy-again/images/authentic-caesar-dressing-recipe-you-ll-never-buy-again_pinrecipes_image_2.webp","caesar-dressing-recipes",,"Transform your salads with this authentic Caesar dressing recipe! With fresh ingredients and a delightful anchovy flavor your taste buds will thank you. Impress your friends and family at your next gathering!","https://www.pinrecipes.org/posts/authentic-caesar-dressing-recipe-you-ll-never-buy-again/?src=authentic-caesar-dressing-recipe-you-ll-never-buy-again-image-2","2026-03-23T23:06:00","SaladDressing, CaesarSalad, CookingFromScratch, HomeChef"
"Festive & Fun Green Recipes for St. Patrick’s Day Celebrations","https://www.pinrecipes.org/posts/easy-and-festive-green-st-patrick-s-day-recipes-everyone-will-love/images/easy-and-festive-green-st-patrick-s-day-recipes-everyone-will-love_pinrecipes_image_2.webp","easy-holiday-recipes",,"Get inspired by easy vibrant green recipes that bring the luck of the Irish to your table! Perfect for parties or family dinners these St. Patrick’s Day dishes are colorful and delicious.","https://www.pinrecipes.org/posts/easy-and-festive-green-st-patrick-s-day-recipes-everyone-will-love/?src=easy-and-festive-green-st-patrick-s-day-recipes-everyone-will-love-image-2","2026-03-24T00:08:00","StPatricksDayRecipes, GreenFood, PartyRecipes, HolidayEats, SimpleCooking"
"Cozy Guinness Beef Stew – Perfect for St. Patrick’s Day!","https://www.pinrecipes.org/posts/hearty-irish-beef-and-guinness-stew-to-warm-your-st-patrick-s-day/images/hearty-irish-beef-and-guinness-stew-to-warm-your-st-patrick-s-day_pinrecipes_image_2.webp","cozy-irish-dinner-recipes",,"Celebrate St. Patrick’s Day with a classic Irish stew simmered in Guinness! Packed with tender beef and root vegetables this hearty dish brings authentic Irish flavors to your table. Ideal for a comforting festive meal.","https://www.pinrecipes.org/posts/hearty-irish-beef-and-guinness-stew-to-warm-your-st-patrick-s-day/?src=hearty-irish-beef-and-guinness-stew-to-warm-your-st-patrick-s-day-image-2","2026-03-24T01:09:00","IrishStew, GuinnessRecipe, StPatricksDay, ComfortFood, BeefRecipes"
"Crisp & Creamy Caesar Salad: A Must-Try Recipe!","https://www.pinrecipes.org/posts/quick-15-minute-caesar-salad-with-garlic-croutons/images/quick-15-minute-caesar-salad-with-garlic-croutons_pinrecipes_image_3.webp","caesar-salad-recipes",,"Elevate your lunch or dinner with this irresistible Caesar salad! Packed with the crunch of fresh romaine savory homemade garlic croutons and a creamy dressing this recipe brings a delightful twist to a classic dish. Whip it up in no time for a satisfying meal that everyone will love!","https://www.pinrecipes.org/posts/quick-15-minute-caesar-salad-with-garlic-croutons/?src=quick-15-minute-caesar-salad-with-garlic-croutons-image-3","2026-03-28T16:01:00","SaladLovers, CaesarSalad, QuickRecipes, HealthyLifestyle"
"Satisfy Your Cravings with This Bacon Caesar Salad","https://www.pinrecipes.org/posts/ultimate-caesar-salad-with-crispy-bacon-and-parmesan/images/ultimate-caesar-salad-with-crispy-bacon-and-parmesan_pinrecipes_image_3.webp","caesar-salad-recipes",,"Satisfy your cravings with this innovative Bacon Caesar Salad! Featuring crispy bacon fresh parmesan and classic Caesar dressing it's a delightful combination of flavors that will tantalize your taste buds. Ideal for a light meal or as a side at dinner. Impress everyone with this fresh take on a timeless dish!","https://www.pinrecipes.org/posts/ultimate-caesar-salad-with-crispy-bacon-and-parmesan/?src=ultimate-caesar-salad-with-crispy-bacon-and-parmesan-image-3","2026-03-28T17:10:00","CrispySalad, BaconCaesar, GourmetSalad, HealthyLifestyle, YummyRecipes"
"Classic Caesar Salad: Freshness in Every Bite!","https://www.pinrecipes.org/posts/classic-caesar-salad-recipe-from-scratch-every-time/images/classic-caesar-salad-recipe-from-scratch-every-time_pinrecipes_image_3.webp","caesar-salad-recipes",,"Dive into a bowl of freshness with our Classic Caesar Salad recipe! Crisp romaine buttery croutons and a creamy dressing come together to create this iconic dish. Perfect for a side or a main course you’ll love this easy-to-follow recipe that highlights quality ingredients.","https://www.pinrecipes.org/posts/classic-caesar-salad-recipe-from-scratch-every-time/?src=classic-caesar-salad-recipe-from-scratch-every-time-image-3","2026-03-28T18:11:00","SaladRecipe, HomeCooking, HealthyLiving, CaesarSalad"
"Comforting Maple Bacon Pork Chops Recipe","https://www.pinrecipes.org/posts/irresistible-maple-bacon-pork-chops-with-dijon-mustard-cream-sauce-easy-comfort-food/images/irresistible-maple-bacon-pork-chops-with-dijon-mustard-cream-sauce-easy-comfort-food_pinrecipes_image_3.webp","easy-dinner-ideas",,"Indulge in the ultimate comfort food with these maple bacon pork chops! The creamy Dijon sauce brings a gourmet touch to an easy recipe. Perfect for family dinners or entertaining guests this dish will impress everyone at your table! 🍁🥘","https://www.pinrecipes.org/posts/irresistible-maple-bacon-pork-chops-with-dijon-mustard-cream-sauce-easy-comfort-food/?src=irresistible-maple-bacon-pork-chops-with-dijon-mustard-cream-sauce-easy-comfort-food-image-3","2026-03-28T19:17:00","PorkChops, ComfortFood, MapleBacon, DijonCream, CookingAtHome"
"Creamy Caesar Dressing That Outshines Store-Bought!","https://www.pinrecipes.org/posts/homemade-caesar-dressing-that-beats-store-bought-every-time/images/homemade-caesar-dressing-that-beats-store-bought-every-time_pinrecipes_image_3.webp","caesar-dressing-recipes",,"Make your own Caesar dressing and elevate your salads to gourmet status! This creamy homemade recipe uses fresh ingredients for a flavor that's unbeatable. Perfect for both entertaining or a quick weeknight meal!","https://www.pinrecipes.org/posts/homemade-caesar-dressing-that-beats-store-bought-every-time/?src=homemade-caesar-dressing-that-beats-store-bought-every-time-image-3","2026-03-28T20:06:00","HomeCooking, CaesarSalad, GourmetDressing, RecipeOfTheDay"
"Creamy Caesar Dressing: A Game Changer for Your Salads","https://www.pinrecipes.org/posts/easy-homemade-caesar-dressing-that-beats-restaurant-style/images/easy-homemade-caesar-dressing-that-beats-restaurant-style_pinrecipes_image_3.webp","caesar-dressing-recipes",,"Whip up this easy homemade Caesar dressing that's creamy tangy and far superior to any bottled version! Made with fresh ingredients like garlic and Parmesan it's perfect for salads sandwiches or veggie dips. A must-try for all food lovers!","https://www.pinrecipes.org/posts/easy-homemade-caesar-dressing-that-beats-restaurant-style/?src=easy-homemade-caesar-dressing-that-beats-restaurant-style-image-3","2026-03-28T20:56:00","EasyRecipes, CaesarDressing, FoodieFavorites, HealthyChoices"
"Classic Caesar Dressing with a Twist!","https://www.pinrecipes.org/posts/homemade-caesar-salad-dressing-a-classic-twist/images/homemade-caesar-salad-dressing-a-classic-twist_pinrecipes_image_3.webp","caesar-dressing-recipes",,"Indulge in this creamy Caesar dressing that's a classic with an exciting twist! Made from fresh ingredients the subtle anchovy flavor will elevate your salads to gourmet status. Perfect for any meal you'll want this recipe on repeat! 🥗👌","https://www.pinrecipes.org/posts/homemade-caesar-salad-dressing-a-classic-twist/?src=homemade-caesar-salad-dressing-a-classic-twist-image-3","2026-03-28T21:59:00","CookingAtHome, CaesarSalad, Flavorful, RecipeIdeas"
"The Only Caesar Dressing Recipe You’ll Ever Need!","https://www.pinrecipes.org/posts/authentic-caesar-dressing-recipe-you-ll-never-buy-again/images/authentic-caesar-dressing-recipe-you-ll-never-buy-again_pinrecipes_image_3.webp","caesar-dressing-recipes",,"Make your salads shine with this homemade Caesar dressing! Fresh flavorful and easy to prepare it features a touch of anchovy that takes it to the next level. Perfect for dinner parties or a special family meal!","https://www.pinrecipes.org/posts/authentic-caesar-dressing-recipe-you-ll-never-buy-again/?src=authentic-caesar-dressing-recipe-you-ll-never-buy-again-image-3","2026-03-28T22:51:00","HealthyEating, CaesarDressing, RecipeOfTheDay, Yum"
"Quick & Festive Green St. Patrick’s Day Dishes Everyone Will Love","https://www.pinrecipes.org/posts/easy-and-festive-green-st-patrick-s-day-recipes-everyone-will-love/images/easy-and-festive-green-st-patrick-s-day-recipes-everyone-will-love_pinrecipes_image_3.webp","easy-holiday-recipes",,"Looking for simple tasty green recipes to celebrate St. Patrick’s Day? These vibrant and festive dishes including creamy dips and fun shamrock treats make holiday cooking a breeze!","https://www.pinrecipes.org/posts/easy-and-festive-green-st-patrick-s-day-recipes-everyone-will-love/?src=easy-and-festive-green-st-patrick-s-day-recipes-everyone-will-love-image-3","2026-03-28T23:49:00","StPatricksDay, GreenFoodIdeas, FestiveRecipes, EasyCooking, HolidayParty"
"Slow-Simmered Irish Beef & Guinness Stew for a Festive Feast","https://www.pinrecipes.org/posts/hearty-irish-beef-and-guinness-stew-to-warm-your-st-patrick-s-day/images/hearty-irish-beef-and-guinness-stew-to-warm-your-st-patrick-s-day_pinrecipes_image_3.webp","cozy-irish-dinner-recipes",,"Enjoy a warm and flavorful Irish beef and Guinness stew this St. Patrick’s Day! Tender beef savory Guinness and hearty root veggies come together for the ultimate cozy dinner. Perfect for sharing with loved ones.","https://www.pinrecipes.org/posts/hearty-irish-beef-and-guinness-stew-to-warm-your-st-patrick-s-day/?src=hearty-irish-beef-and-guinness-stew-to-warm-your-st-patrick-s-day-image-3","2026-03-29T00:37:00","StPatricksDayRecipes, IrishBeefStew, Guinness, ComfortMeals, HolidayCooking"
"Caesar Salad: A Fresh Take on a Classic","https://www.pinrecipes.org/posts/quick-15-minute-caesar-salad-with-garlic-croutons/images/quick-15-minute-caesar-salad-with-garlic-croutons_pinrecipes_image_4.webp","caesar-salad-recipes",,"This Caesar salad combines the freshness of crisp romaine with homemade garlic croutons and a creamy dressing bringing a modern twist to a beloved classic. Perfect for a light lunch or dinner this recipe is quick easy and satisfying.","https://www.pinrecipes.org/posts/quick-15-minute-caesar-salad-with-garlic-croutons/?src=quick-15-minute-caesar-salad-with-garlic-croutons-image-4","2026-04-02T16:07:00","CaesarSalad, SaladRecipes, HealthyEating, QuickLunch, HomemadeCroutons"
"Crispy Bacon Caesar Salad: A Fresh Take on a Classic","https://www.pinrecipes.org/posts/ultimate-caesar-salad-with-crispy-bacon-and-parmesan/images/ultimate-caesar-salad-with-crispy-bacon-and-parmesan_pinrecipes_image_4.webp","caesar-salad-recipes",,"This Caesar salad elevates the classic with crispy bacon and fresh parmesan creating a delicious balance of flavors and textures. It's a fantastic option for a light lunch or a side at dinner. Discover how this twist on a timeless recipe will impress your family and friends.","https://www.pinrecipes.org/posts/ultimate-caesar-salad-with-crispy-bacon-and-parmesan/?src=ultimate-caesar-salad-with-crispy-bacon-and-parmesan-image-4","2026-04-02T17:16:00","CaesarSalad, FreshSalads, HealthyEating, BaconLovers, SaladRecipes"
"Classic Caesar Salad: A Timeless Favorite","https://www.pinrecipes.org/posts/classic-caesar-salad-recipe-from-scratch-every-time/images/classic-caesar-salad-recipe-from-scratch-every-time_pinrecipes_image_4.webp","caesar-salad-recipes",,"Discover how to make a classic Caesar salad from scratch featuring crisp romaine lettuce homemade croutons and a creamy dressing that will impress your guests. This recipe combines fresh ingredients with simple techniques ensuring a delicious result every time.","https://www.pinrecipes.org/posts/classic-caesar-salad-recipe-from-scratch-every-time/?src=classic-caesar-salad-recipe-from-scratch-every-time-image-4","2026-04-02T18:15:00","CaesarSalad, SaladRecipes, HomemadeDressing, HealthyEating, FreshIngredients"
"Irresistible Maple Bacon Pork Chops with Dijon Mustard Cream Sauce – Easy Comfort Food!","https://www.pinrecipes.org/posts/irresistible-maple-bacon-pork-chops-with-dijon-mustard-cream-sauce-easy-comfort-food/images/irresistible-maple-bacon-pork-chops-with-dijon-mustard-cream-sauce-easy-comfort-food_pinrecipes_image_4.webp","easy-dinner-ideas",,"These maple bacon pork chops are a delightful twist on comfort food. The creamy Dijon sauce adds a rich flavor perfect for family dinners or special occasions!","https://www.pinrecipes.org/posts/irresistible-maple-bacon-pork-chops-with-dijon-mustard-cream-sauce-easy-comfort-food/?src=irresistible-maple-bacon-pork-chops-with-dijon-mustard-cream-sauce-easy-comfort-food-image-4","2026-04-02T19:08:00","porkchops, comfortfood, easyrecipe"
