Title,Media URL,Pinterest board,Thumbnail,Description,Link,Publish date,Keywords
"Deliciously Easy Artisan Sourdough Focaccia","https://www.pinrecipes.org/posts/artisan-sourdough-focaccia-with-garlic-and-fresh-herbs/images/artisan-sourdough-focaccia-with-garlic-and-fresh-herbs_pinrecipes_image_2.webp","sourdough-focaccia-recipes","","Bake your own artisan sourdough focaccia infused with aromatic garlic and fresh herbs! This deliciously easy recipe will guide you step-by-step, ensuring a perfect loaf every time. Ideal for gatherings or cozy nights in, impress your guests with this homemade treat.","https://www.pinrecipes.org/posts/artisan-sourdough-focaccia-with-garlic-and-fresh-herbs/?src=artisan-sourdough-focaccia-with-garlic-and-fresh-herbs-image-2","2026-03-22T15:58:00","FocacciaRecipe, Sourdough, HomemadeBread, BakingTips, Foodie"
"Speedy & Satisfying Tater Tot Comfort Dish","https://www.pinrecipes.org/posts/quick-and-easy-tater-tot-casserole-for-busy-nights/images/quick-and-easy-tater-tot-casserole-for-busy-nights_pinrecipes_image_2.webp","tater-tot-recipes","","Whip up a delicious Tater Tot Casserole in no time! This comforting dish is packed with flavor and is perfect for busy weeknights when you need a quick meal that doesn't sacrifice taste. Find out how to make this favorite family recipe that everyone will love.","https://www.pinrecipes.org/posts/quick-and-easy-tater-tot-casserole-for-busy-nights/?src=quick-and-easy-tater-tot-casserole-for-busy-nights-image-2","2026-03-22T17:14:00","ComfortFood, TaterTots, QuickRecipes"
"Deliciously Simple Sourdough Focaccia Recipe","https://www.pinrecipes.org/posts/quick-and-easy-sourdough-focaccia-recipe-for-beginners/images/quick-and-easy-sourdough-focaccia-recipe-for-beginners_pinrecipes_image_2.webp","sourdough-focaccia-recipes","","Elevate your bread game with this Deliciously Simple Sourdough Focaccia recipe! Perfectly airy and crispy, this bread is an ideal base for your favorite toppings or a tasty side to any dish. Learn the secrets to making this mouthwatering focaccia using your sourdough starter! 🌟","https://www.pinrecipes.org/posts/quick-and-easy-sourdough-focaccia-recipe-for-beginners/?src=quick-and-easy-sourdough-focaccia-recipe-for-beginners-image-2","2026-03-22T18:19:00","SourdoughFocaccia, HomeBaking, EasyRecipes, Foodie"
"Melt-in-Your-Mouth Tater Tot Casserole","https://www.pinrecipes.org/posts/cheesy-tater-tot-casserole-that-kids-actually-love/images/cheesy-tater-tot-casserole-that-kids-actually-love_pinrecipes_image_2.webp","tater-tot-recipes","","Savor the melt-in-your-mouth experience of our cheesy tater tot casserole! With layers of creamy goodness and deliciously crispy tots, this dish is sure to warm your heart and satisfy your cravings. Perfect for any occasion!","https://www.pinrecipes.org/posts/cheesy-tater-tot-casserole-that-kids-actually-love/?src=cheesy-tater-tot-casserole-that-kids-actually-love-image-2","2026-03-22T19:32:00","CheesyCasserole, EasyRecipes, PotluckFood"
"Ultimate Caesar Salad: Dressing & Croutons Made Easy","https://www.pinrecipes.org/posts/perfect-caesar-salad-restaurant-quality-at-home/images/perfect-caesar-salad-restaurant-quality-at-home_pinrecipes_image_2.webp","caesar-salad-recipes","","Your search for the perfect Caesar salad ends here! Dive into this delicious recipe featuring a homemade dressing and irresistibly crispy croutons. It's the ideal dish for gatherings or a solo treat. Experience the blend of fresh ingredients with rich flavors! 🥬🍞","https://www.pinrecipes.org/posts/perfect-caesar-salad-restaurant-quality-at-home/?src=perfect-caesar-salad-restaurant-quality-at-home-image-2","2026-03-22T20:44:00","CaesarSalad, RecipeOfTheDay, FoodieFavorites, HealthyRecipes, Yummy"
"Elevate Your Salad Game: Classic Caesar with Homemade Croutons","https://www.pinrecipes.org/posts/easy-caesar-salad-with-crispy-parmesan-and-croutons/images/easy-caesar-salad-with-crispy-parmesan-and-croutons_pinrecipes_image_2.webp","caesar-salad-recipes","","Learn how to make a delicious Caesar salad featuring crisp romaine, crunchy homemade croutons, and a rich, creamy dressing. This classic dish is a must-try for salad lovers! Impress your family and friends at your next meal.","https://www.pinrecipes.org/posts/easy-caesar-salad-with-crispy-parmesan-and-croutons/?src=easy-caesar-salad-with-crispy-parmesan-and-croutons-image-2","2026-03-22T22:04:00","SaladLove, CaesarSalad, CookingAtHome, RecipeIdeas"
"The Ultimate Creamy Caesar Salad Dressing Recipe","https://www.pinrecipes.org/posts/the-best-homemade-caesar-salad-dressing-you-ll-ever-make/images/the-best-homemade-caesar-salad-dressing-you-ll-ever-make_pinrecipes_image_2.webp","caesar-salad-recipes","","Indulge in the luxurious taste of our creamy Caesar salad dressing! Featuring quality ingredients like anchovy for a savory kick, this versatile dressing is ideal for salads or as a dip for your favorite veggies. Perfect for gatherings or quick meals, elevate your dishes effortlessly!","https://www.pinrecipes.org/posts/the-best-homemade-caesar-salad-dressing-you-ll-ever-make/?src=the-best-homemade-caesar-salad-dressing-you-ll-ever-make-image-2","2026-03-22T23:26:00","CreamyCaesar, HealthyRecipes, FoodieFavorites"
"Timeless Caesar Salad: A Fresh Twist","https://www.pinrecipes.org/posts/creamy-caesar-salad-with-fresh-romaine-and-anchovies/images/creamy-caesar-salad-with-fresh-romaine-and-anchovies_pinrecipes_image_2.webp","caesar-salad-recipes","","Savor the timeless flavors of Caesar salad with a fresh twist! This recipe features crunchy romaine, delectable homemade croutons, and a rich anchovy dressing that will tantalize your taste buds. Perfect for any occasion, this salad is the ultimate crowd-pleaser. Enjoy it as a light meal or side dish!","https://www.pinrecipes.org/posts/creamy-caesar-salad-with-fresh-romaine-and-anchovies/?src=creamy-caesar-salad-with-fresh-romaine-and-anchovies-image-2","2026-03-23T00:29:00","SaladRecipe, HealthyFood, CookingAtHome, Delicious"
"Ultimate Caesar Salad: Fresh & Flavorful Recipe","https://www.pinrecipes.org/posts/the-ultimate-caesar-salad-recipe-you-need-to-try/images/the-ultimate-caesar-salad-recipe-you-need-to-try_pinrecipes_image_2.webp","caesar-salad-recipes","","Discover the ultimate Caesar salad that's perfect for gatherings or a cozy weeknight dinner! Our fresh take combines crisp romaine lettuce, a zesty homemade dressing, crunchy croutons, and shaved parmesan to tantalize your taste buds. This salad is not just a side; it's a star! Give it a try and enjoy the compliments!","https://www.pinrecipes.org/posts/the-ultimate-caesar-salad-recipe-you-need-to-try/?src=the-ultimate-caesar-salad-recipe-you-need-to-try-image-2","2026-03-23T01:44:00","SaladRecipe, CaesarSalad, Foodie, HealthyRecipes, CookingAtHome"
"Crispy Crunchy Caesar Salad Recipe","https://www.pinrecipes.org/posts/crisp-and-zesty-caesar-salad-for-dinner-tonight/images/crisp-and-zesty-caesar-salad-for-dinner-tonight_pinrecipes_image_2.webp","caesar-salad-recipes","","Discover the crispy and crunchy world of Caesar salads! This recipe features crisp romaine, tangy homemade dressing, and perfectly baked croutons that add texture to every bite. Ideal for a refreshing lunch or a complement to your dinner. Try it today and bring a classic dish back to life!","https://www.pinrecipes.org/posts/crisp-and-zesty-caesar-salad-for-dinner-tonight/?src=crisp-and-zesty-caesar-salad-for-dinner-tonight-image-2","2026-03-23T03:01:00","CaesarSalad, CrunchyCroutons, HealthyRecipes, QuickMeal, SaladRecipe"