Title,Media URL,Pinterest board,Thumbnail,Description,Link,Publish date,Keywords
"Homemade Caesar Dressing That Beats Store-Bought Every Time","https://www.pinrecipes.org/posts/homemade-caesar-dressing-that-beats-store-bought-every-time/images/homemade-caesar-dressing-that-beats-store-bought-every-time_pinrecipes_image_4.webp","caesar-dressing-recipes",,"This creamy Caesar dressing is a game changer for your salads. Made from scratch with fresh ingredients it’s perfect for entertaining or a weeknight treat!","https://www.pinrecipes.org/posts/homemade-caesar-dressing-that-beats-store-bought-every-time/?src=homemade-caesar-dressing-that-beats-store-bought-every-time-image-4","2026-04-02T20:09:00","CaesarDressing, Homemade, SaladDressing"
"Easy Homemade Caesar Dressing That Beats Restaurant Style","https://www.pinrecipes.org/posts/easy-homemade-caesar-dressing-that-beats-restaurant-style/images/easy-homemade-caesar-dressing-that-beats-restaurant-style_pinrecipes_image_4.webp","caesar-dressing-recipes",,"This homemade Caesar dressing is creamy tangy and way better than store-bought! With fresh garlic and Parmesan it’s perfect for salads or dipping veggies.","https://www.pinrecipes.org/posts/easy-homemade-caesar-dressing-that-beats-restaurant-style/?src=easy-homemade-caesar-dressing-that-beats-restaurant-style-image-4","2026-04-02T21:05:00","CaesarDressing, Homemade, SaladDressing"
"Homemade Caesar Salad Dressing: A Classic Twist","https://www.pinrecipes.org/posts/homemade-caesar-salad-dressing-a-classic-twist/images/homemade-caesar-salad-dressing-a-classic-twist_pinrecipes_image_4.webp","caesar-dressing-recipes",,"This creamy Caesar dressing is a game changer for salads! Made with fresh ingredients it’s perfect for elevating your greens at any meal. You’ll love the hint of anchovy that adds depth!","https://www.pinrecipes.org/posts/homemade-caesar-salad-dressing-a-classic-twist/?src=homemade-caesar-salad-dressing-a-classic-twist-image-4","2026-04-02T22:06:00","CaesarDressing, SaladDressing, Homemade"
"Authentic Caesar Dressing Recipe You'll Never Buy Again","https://www.pinrecipes.org/posts/authentic-caesar-dressing-recipe-you-ll-never-buy-again/images/authentic-caesar-dressing-recipe-you-ll-never-buy-again_pinrecipes_image_4.webp","caesar-dressing-recipes",,"This homemade Caesar dressing is a game changer! With fresh ingredients and a touch of anchovy it elevates any salad. Perfect for impressing guests at dinner parties!","https://www.pinrecipes.org/posts/authentic-caesar-dressing-recipe-you-ll-never-buy-again/?src=authentic-caesar-dressing-recipe-you-ll-never-buy-again-image-4","2026-04-02T23:00:00","CaesarDressing, Homemade, SaladDressing"
"Easy and Festive Green St. Patrick's Day Recipes Everyone Will Love","https://www.pinrecipes.org/posts/easy-and-festive-green-st-patrick-s-day-recipes-everyone-will-love/images/easy-and-festive-green-st-patrick-s-day-recipes-everyone-will-love_pinrecipes_image_4.webp","easy-holiday-recipes",,"If you’re looking for simple fun green recipes to celebrate St. Patrick’s Day these dishes hit the spot. From vibrant spinach dips to shamrock-shaped treats they’re perfect for getting festive without fuss.","https://www.pinrecipes.org/posts/easy-and-festive-green-st-patrick-s-day-recipes-everyone-will-love/?src=easy-and-festive-green-st-patrick-s-day-recipes-everyone-will-love-image-4","2026-04-03T00:01:00","StPatricksDay, GreenRecipes, EasyCooking"
"Hearty Irish Beef and Guinness Stew to Warm Your St. Patrick’s Day","https://www.pinrecipes.org/posts/hearty-irish-beef-and-guinness-stew-to-warm-your-st-patrick-s-day/images/hearty-irish-beef-and-guinness-stew-to-warm-your-st-patrick-s-day_pinrecipes_image_4.webp","cozy-irish-dinner-recipes",,"This classic Irish stew is rich and comforting simmered slowly with Guinness for depth. The tender beef and root veggies soak up all the flavors—perfect for a cozy St. Paddy’s Day dinner with friends or family.","https://www.pinrecipes.org/posts/hearty-irish-beef-and-guinness-stew-to-warm-your-st-patrick-s-day/?src=hearty-irish-beef-and-guinness-stew-to-warm-your-st-patrick-s-day-image-4","2026-04-03T00:55:00","IrishStew, GuinnessRecipe, ComfortFood"